<?xml version="1.0" encoding="UTF-8"?>
<!DOCTYPE school SYSTEM "students.dtd">
<school>
    <students>
        <student>
            <id>S001</id>
            <name>Eric Iradukunda</name>
            <age>20</age>
            <courseId>C101</courseId>
        </student>
        <student>
            <id>S002</id>
            <name>Aline Mukamana</name>
            <age>22</age>
            <courseId>C102</courseId>
        </student>
        <student>
            <id>S003</id>
            <name>Claude Niyonzima</name>
            <age>21</age>
            <courseId>C103</courseId>
        </student>
    </students>

    <courses>
        <course>
            <id>C101</id>
            <name>Mathematics</name>
            <instructor>Mr. Habimana</instructor>
        </course>
        <course>
            <id>C102</id>
            <name>Computer Science</name>
            <instructor>Ms. Uwase</instructor>
        </course>
        <course>
            <id>C103</id>
            <name>Physics</name>
            <instructor>Mr. Nkurunziza</instructor>
        </course>
    </courses>

    <grades>
        <grade>
            <studentId>S001</studentId>
            <courseId>C101</courseId>
            <score>A</score>
        </grade>
        <grade>
            <studentId>S002</studentId>
            <courseId>C102</courseId>
            <score>B+</score>
        </grade>
        <grade>
            <studentId>S003</studentId>
            <courseId>C103</courseId>
            <score>A-</score>
        </grade>
    </grades>
</school>
